{
  "producer": "opencv 4.12.0",
  "method": "calibrateCameraExtended (CALIB_FIX_K3)",
  "parameters": {
    "fx": 724.7709333697354,
    "fy": 735.5723786995243,
    "cx": 513.9292231868336,
    "cy": 292.9468790436237,
    "k1": 0.0011608365373032862,
    "k2": -0.05262073695979119,
    "p1": -0.0014296470645483075,
    "p2": 0.0014250932030302108,
    "k3": 0.0
  },
  "poses": {},
  "sigma": {
    "fx": 3.8677021602867714,
    "fy": 3.9266478932302746,
    "cx": 0.9317998406921565,
    "cy": 0.7710430561843202,
    "k1": 0.0022925618757516893,
    "k2": 0.007104018107604861,
    "p1": 0.0002191350690534327,
    "p2": 0.00032880445008022047
  },
  "mean_reproj_error": 0.24415229260921478
}
