{
  "producer": "opencv 4.12.0",
  "method": "calibrateCameraExtended (CALIB_TILTED_MODEL, CALIB_FIX_K3)",
  "parameters": {
    "fx": 998.8410473400448,
    "fy": 987.4480370305484,
    "cx": 638.626969447625,
    "cy": 554.7778952465267,
    "k1": -0.12355779240116885,
    "k2": 0.054344552266663314,
    "p1": -0.009028710993440377,
    "p2": 4.2210017232477e-06,
    "k3": 0.0,
    "tilt_x": 0.026353238165960354,
    "tilt_y": 0.021160345616401576
  },
  "poses": {},
  "sigma": {
    "fx": 1.1406422883924,
    "fy": 1.564695710449914,
    "cx": 4.057870292218499,
    "cy": 40.10115643720052,
    "k1": 0.0032774258240753497,
    "k2": 0.015593475575928778,
    "p1": 0.004604308210027045,
    "p2": 0.0004500321647619676,
    "tilt_x": 0.04010597216715078,
    "tilt_y": 0.003757187613310813
  },
  "mean_reproj_error": 0.6563911437988281
}
