{
  "producer": "opencv 4.12.0",
  "method": "calibrateCameraExtended (CALIB_FIX_K3) per camera, stereoCalibrate (CALIB_FIX_INTRINSIC)",
  "parameters": {
    "cam0.fx": 713.7987704858788,
    "cam0.fy": 724.622234226799,
    "cam0.cx": 523.4039857026704,
    "cam0.cy": 285.9406449403923,
    "cam0.k1": 0.014990164274848658,
    "cam0.k2": -0.07145850818640985,
    "cam0.p1": 0.0006163624824162954,
    "cam0.p2": 0.0002478148632154326,
    "cam0.k3": 0.0,
    "cam1.fx": 724.7709333697354,
    "cam1.fy": 735.5723786995243,
    "cam1.cx": 513.9292231868336,
    "cam1.cy": 292.9468790436237,
    "cam1.k1": 0.0011608365373032862,
    "cam1.k2": -0.05262073695979119,
    "cam1.p1": -0.0014296470645483075,
    "cam1.p2": 0.0014250932030302108,
    "cam1.k3": 0.0
  },
  "poses": {
    "cam0.cam_se3_rig": {
      "rotation": [
        0.0,
        0.0,
        0.0,
        1.0
      ],
      "translation": [
        0.0,
        0.0,
        0.0
      ]
    },
    "cam1.cam_se3_rig": {
      "rotation": [
        0.013136008926460722,
        -0.01738221311184497,
        -0.004072595891604985,
        0.9997543287725851
      ],
      "translation": [
        0.1891319709564954,
        -0.00454961012720718,
        0.010018835115332792
      ]
    }
  },
  "sigma": {
    "cam0.fx": 3.957096966192664,
    "cam0.fy": 4.0339784553738,
    "cam0.cx": 0.8707743932974112,
    "cam0.cy": 0.7389367559200599,
    "cam0.k1": 0.002298318155793812,
    "cam0.k2": 0.004655242606973089,
    "cam0.p1": 0.0001633635227980091,
    "cam0.p2": 0.0003627859285508014,
    "cam1.fx": 3.8677021602867714,
    "cam1.fy": 3.9266478932302746,
    "cam1.cx": 0.9317998406921565,
    "cam1.cy": 0.7710430561843202,
    "cam1.k1": 0.0022925618757516893,
    "cam1.k2": 0.007104018107604861,
    "cam1.p1": 0.0002191350690534327,
    "cam1.p2": 0.00032880445008022047
  },
  "mean_reproj_error": null
}
