{
  "producer": "opencv 4.12.0",
  "method": "fisheye.stereoCalibrate (CALIB_RECOMPUTE_EXTRINSIC, CALIB_CHECK_COND, CALIB_FIX_SKEW)",
  "parameters": {
    "cam0.fx": 561.1959259272506,
    "cam0.fy": 562.8494020297131,
    "cam0.cx": 621.2824002724136,
    "cam0.cy": 380.5554553808907,
    "cam0.k1": -7.4425371658148e-05,
    "cam0.k2": -0.0070266203393040735,
    "cam0.k3": 0.0073756982364730625,
    "cam0.k4": -0.0034223025643988552,
    "cam1.fx": 560.3954525353507,
    "cam1.fy": 561.9017102142227,
    "cam1.cx": 678.9716520403607,
    "cam1.cy": 380.40134053534126,
    "cam1.k1": -0.013078543567746534,
    "cam1.k2": 0.028443450538344503,
    "cam1.k3": -0.03603338699004,
    "cam1.k4": 0.014472406234717784
  },
  "poses": {
    "cam0.cam_se3_rig": {
      "rotation": [
        0.0,
        0.0,
        0.0,
        1.0
      ],
      "translation": [
        0.0,
        0.0,
        0.0
      ]
    },
    "cam1.cam_se3_rig": {
      "rotation": [
        -0.0030280213567780915,
        0.003142925112766912,
        -0.034796001554588674,
        0.9993849065221125
      ],
      "translation": [
        -0.09940272472412097,
        0.0027081213926540525,
        0.0012933029247272267
      ]
    }
  },
  "sigma": {},
  "mean_reproj_error": null
}
