{
  "producer": "opencv 4.12.0",
  "method": "calibrateCameraExtended (CALIB_FIX_K3), calibrateRobotWorldHandEye (Shah)",
  "parameters": {
    "fx": 2057.815122404822,
    "fy": 2058.3681863934235,
    "cx": 962.0612315734408,
    "cy": 609.8882766813224,
    "k1": -0.11404866644952019,
    "k2": 0.14345070351911662,
    "p1": 0.00027906316934664144,
    "p2": 0.0002607440612443811,
    "k3": 0.0
  },
  "poses": {
    "gripper_se3_camera": {
      "rotation": [
        -0.49971008253533056,
        0.5251694382169244,
        -0.48368273098782866,
        0.4904466437030729
      ],
      "translation": [
        0.2593687671951739,
        0.0323523016905013,
        -0.10258517670823863
      ]
    },
    "base_se3_target": {
      "rotation": [
        -0.4883273844372772,
        0.5102819435200747,
        -0.5031505740876877,
        0.49798413982902445
      ],
      "translation": [
        2.755164044515115,
        -0.27551496114222485,
        0.6962856906530411
      ]
    }
  },
  "sigma": {
    "fx": 0.33469793810548343,
    "fy": 0.33085514105821473,
    "cx": 0.2362728563598422,
    "cy": 0.2060117496182608,
    "k1": 0.00022938189081310177,
    "k2": 0.0009206272968250934,
    "p1": 2.0472800560072427e-05,
    "p2": 2.5444151875789393e-05
  },
  "mean_reproj_error": 2.2545175552368164
}
