{
  "producer": "opencv 4.12.0",
  "method": "calibrateCameraExtended (CALIB_FIX_K3) and calibrateRobotWorldHandEye (Shah) per camera; rig frame = camera 0",
  "parameters": {
    "cam0.fx": 1186.2492458594738,
    "cam0.fy": 1188.4610459385403,
    "cam0.cx": 611.3148640423989,
    "cam0.cy": 516.4505545519347,
    "cam0.k1": -0.20907160977919179,
    "cam0.k2": 0.11616417474209409,
    "cam0.p1": 6.92383666993468e-05,
    "cam0.p2": -0.00021905384343280193,
    "cam0.k3": 0.0,
    "cam1.fx": 1175.5527152603274,
    "cam1.fy": 1177.3873072721497,
    "cam1.cx": 614.2697824583895,
    "cam1.cy": 520.4137988702554,
    "cam1.k1": -0.20549142935228265,
    "cam1.k2": 0.10702903523438775,
    "cam1.p1": 0.0019074522966486857,
    "cam1.p2": -0.0004631615104851971,
    "cam1.k3": 0.0,
    "cam2.fx": 589.9623372062166,
    "cam2.fy": 589.9660085077203,
    "cam2.cx": 298.63984361584085,
    "cam2.cy": 237.17167387612716,
    "cam2.k1": 0.018350507492315052,
    "cam2.k2": -0.0787537987742313,
    "cam2.p1": 0.000305545028414866,
    "cam2.p2": -0.002317384860540733,
    "cam2.k3": 0.0
  },
  "poses": {
    "gripper_se3_rig": {
      "rotation": [
        0.001780980294273302,
        -0.001662742504241513,
        -0.036005908718828965,
        0.9993486068104
      ],
      "translation": [
        0.049393243981115775,
        -0.012319953560886132,
        -0.018408599707464012
      ]
    },
    "base_se3_target": {
      "rotation": [
        -0.5018714483126078,
        -0.49922554102734057,
        0.49419854229725874,
        0.5046451320936616
      ],
      "translation": [
        -2.1895409004472555,
        -0.3694192373772072,
        0.9709210124346543
      ]
    },
    "cam0.cam_se3_rig": {
      "rotation": [
        -0.0,
        -0.0,
        5.268356063861754e-09,
        1.0
      ],
      "translation": [
        0.0,
        4.336808689942018e-19,
        0.0
      ]
    },
    "cam1.cam_se3_rig": {
      "rotation": [
        0.0015528597415747825,
        -0.0013917553271056325,
        -0.00133124057660285,
        0.9999969397164472
      ],
      "translation": [
        0.07229503251264985,
        -0.0020930049245259613,
        -0.008529961898601003
      ]
    },
    "cam2.cam_se3_rig": {
      "rotation": [
        -0.003494681559526334,
        -0.0011334965209281607,
        0.0018681140028964985,
        0.9999915062321814
      ],
      "translation": [
        0.04992508093298156,
        0.06233957695732899,
        -0.018279886328928043
      ]
    }
  },
  "sigma": {
    "cam0.fx": 1.634827296768723,
    "cam0.fy": 1.6250629645160102,
    "cam0.cx": 0.4262001984588761,
    "cam0.cy": 0.4668072527683267,
    "cam0.k1": 0.0008378801669576469,
    "cam0.k2": 0.002052354980205573,
    "cam0.p1": 7.18297698887979e-05,
    "cam0.p2": 6.835531295127968e-05,
    "cam1.fx": 1.5328977516684292,
    "cam1.fy": 1.521754064677151,
    "cam1.cx": 0.4151031965327435,
    "cam1.cy": 0.4535180654605822,
    "cam1.k1": 0.0008334862243104872,
    "cam1.k2": 0.0021461685029813705,
    "cam1.p1": 6.414135237803262e-05,
    "cam1.p2": 6.112453677560861e-05,
    "cam2.fx": 2.0949712102876537,
    "cam2.fy": 2.074965356349169,
    "cam2.cx": 0.5776612875301589,
    "cam2.cy": 0.6261081806478842,
    "cam2.k1": 0.001742195868097569,
    "cam2.k2": 0.004985703423381208,
    "cam2.p1": 0.0002231805417935018,
    "cam2.p2": 0.0002723162652339886
  },
  "mean_reproj_error": null
}
