{
  "producer": "opencv 4.12.0",
  "method": "calibrateCameraExtended (CALIB_FIX_K3) per camera, stereoCalibrate (CALIB_USE_INTRINSIC_GUESS, CALIB_FIX_K3)",
  "parameters": {
    "cam0.fx": 850.9854002976524,
    "cam0.fy": 846.0376475232526,
    "cam0.cx": 638.0584020472394,
    "cam0.cy": 479.5924298155987,
    "cam0.k1": -0.047851988623369646,
    "cam0.k2": -0.008302434250598078,
    "cam0.p1": -9.103490432495353e-05,
    "cam0.p2": -0.0006857331890344628,
    "cam0.k3": 0.0,
    "cam1.fx": 821.3684489127171,
    "cam1.fy": 816.333334330727,
    "cam1.cx": 651.200215894164,
    "cam1.cy": 469.5313374398101,
    "cam1.k1": -0.038571099465614184,
    "cam1.k2": -0.005409261811176295,
    "cam1.p1": -0.0001910359051755892,
    "cam1.p2": 0.0005765197984420056,
    "cam1.k3": 0.0
  },
  "poses": {
    "cam0.cam_se3_rig": {
      "rotation": [
        0.0,
        0.0,
        0.0,
        1.0
      ],
      "translation": [
        0.0,
        0.0,
        0.0
      ]
    },
    "cam1.cam_se3_rig": {
      "rotation": [
        -0.00011798478088435506,
        0.023050399282276895,
        2.9008986488504783e-05,
        0.9997342968664213
      ],
      "translation": [
        -0.05989405987267519,
        -9.983244470156488e-05,
        0.0032008046755518395
      ]
    }
  },
  "sigma": {},
  "mean_reproj_error": null
}
